id,category_id,knowledge_id,description,optional,solution,specify,required_stars,required_employee_rank_id,achieve_employee_rank_id,conversation_id
1,1,,"<p>In diesem Kapitel werden die Aufgaben noch sehr leicht sein, um dir ein Gefühl dafür zu geben wie diese Plattform funktioniert.<br/>Außerdem erfährst Du nebenbei schon etwas über JavaScript, ist das nicht toll?</p>",f,"{""0"":true}","{""type"": ""multiple_choice"", ""options"": [{""id"": 0, ""text"": ""Ja""}]}",,,,
2,1,1,"<ul><li>An dieser Stelle wird dir die Aufgabenstellung angezeigt</li><li>Direkt unter der Aufgabenstellung findest Du ggf. Informationen, die Du für die Lösung der Aufgabe benötigst<br/>(Die Infos kannst Du auch nochmal in deinem persönlichen Tagebuch nachlesen)</li><li>Im nächsten Feld hast Du dann die Möglichkeit deine Antwort einzugeben/auszuwählen<br/>(Je nach Aufgabe unterscheidet sich die Art der Antwortmöglichkeiten)</li><li>Mit dem Button unten links kannst Du deine Antwort abschicken</li></ul><p><b>Deine Aufgabe:</b> Wähle die richtigen Eigenschaften von JavaScript aus!</p>",f,"{""0"":true,""1"":false,""2"":false,""3"":true,""4"":true}","{""type"": ""multiple_choice"", ""options"": [{""id"": 0, ""text"": ""Dynamisch typisiert""}, {""id"": 1, ""text"": ""Statisch typisiert""}, {""id"": 2, ""text"": ""Prozedural""}, {""id"": 3, ""text"": ""Objektorientiert""}, {""id"": 4, ""text"": ""Prototypen-basiert""}]}",,,,
3,1,2,"<ul><li>Wenn Du falsche Antworten abschickst siehst Du über diesem Feld, dass sich die Anzahl deiner Versuche erhöht</li><li>Die Anzahl deiner Versuche beeinflusst deine Bewertung (in Form von Sternen) für diese Aufgabe</li><li>Nachdem Du eine Aufgabe geschafft hast, kannst Du versuchen dich zu verbessern<br/>(Es zählt immer dein bester Durchlauf)</li><li>Du willst wissen, wie Du im Vergleich zu anderen dastehst? Dann schau mal im Sider (links) bei der Rangliste vorbei!</li></ul><p>Wenn Du willst, kannst Du ja mal ausprobieren, was passiert wenn Du die falsche Antwort auswählst.<br/><b>Deine Aufgabe:</b> Wo sollte JavaScript über &lt;script type=""text/javascript""&gt; ... &lt;/script&gt; nicht eingefügt werden?</p>",f,"{""0"":false,""1"":false,""2"":true}","{""type"": ""multiple_choice"", ""options"": [{""id"": 0, ""text"": ""Mit im <head>""}, {""id"": 1, ""text"": ""Immer ganz oben im <body>""}, {""id"": 2, ""text"": ""Unter dem Element, das ggf. referenziert wird (unten im <body>)""}]}",,,,
4,1,5,"<ul><li>Es gibt optionale Aufgaben, die Du (wer hätte es gedacht) nicht richtig beantworten musst</li><li>Um die jeweils letzte Aufgabe pro Thema beantworten zu können, brauchst Du aber eine bestimmte Anzahl an Sternen</li><li>Diese erreichst Du mit den Pflicht-Aufgaben nur dann, wenn Du immer 3 Sterne als Bewertung erhälst</li></ul><p>Deine Aufgabe: Wie heißt der Modus, der dich vor Fehlern bewahren kann?</p>",t,"{""0"":false,""1"":true,""2"":false}","{""type"": ""multiple_choice"", ""options"": [{""id"": 0, ""text"": ""Einen solchen Modus gibt nicht""}, {""id"": 1, ""text"": ""Strict Mode""}, {""id"": 2, ""text"": ""Continuous Mode""}]}",,,,
5,1,3,"<p>Wenn dir der aktuelle Modus nicht gefällt, kannst Du diesen auf der Startseite wechseln.<br/>(Dein Fortschritt bleibt erhalten)<br/><b>Deine Aufgabe:</b> Kommentiere den Blödsinn aus dem bisherigen Code aus!</p>",t,0,"{""type"": ""code"", ""placeholder_before"": """", ""placeholder_middle"":""Blödsinn\n\nMehrzeiliger\nBlödsinn"", ""placeholder_after"":""return 0;""}",,,,
6,1,4,<p>Mit dem Abschließen von Kapiteln erhälst du Abzeichen bzw. Titel<br/>(Mit dem Abschluss dieses Kapitels bist Du ein Praktikant)<br/><br/><b>Deine Aufgabe: </b>Drücke auf Bestätigen und hab Spaß!</p>,f,0,"{""type"": ""code"", ""placeholder_before"": ""alert(`Das hier ist eine Alert Box`);"", ""placeholder_middle"": """", ""placeholder_after"": ""return 0;""}",9,,1,
